{
  "schema_version": 1,
  "pack_id": "ru-core-example",
  "target_language": {
    "tag": "ru",
    "name": "Russian",
    "native_name": "Русский"
  },
  "character_requirements": {
    "unicode_ranges": [
      "Basic Latin",
      "Cyrillic"
    ],
    "rom_font_status": "requires_font_work",
    "notes": "The learner build contains all 66 Russian letters in reserved Latin slots. Text outside translated scenes still needs translation."
  },
  "vocabulary": [
    {
      "id": "ru.privet",
      "lemma": "привет",
      "english": "hello",
      "part_of_speech": "interjection",
      "cefr": "A1",
      "first_introduction": "littleroot.player_house.mom.welcome.001",
      "forms": [
        "привет"
      ]
    },
    {
      "id": "ru.dom",
      "lemma": "дом",
      "english": "home; house",
      "part_of_speech": "noun",
      "cefr": "A1",
      "first_introduction": "littleroot.player_house.mom.welcome.001",
      "forms": [
        "дом",
        "дома",
        "домой"
      ]
    },
    {
      "id": "ru.dobro_pozhalovat",
      "lemma": "добро пожаловать",
      "english": "welcome",
      "part_of_speech": "fixed expression",
      "cefr": "A1",
      "first_introduction": "littleroot.player_house.mom.welcome.001",
      "forms": [
        "добро пожаловать"
      ]
    },
    {
      "id": "ru.pokemon",
      "lemma": "покемон",
      "english": "Pokémon",
      "part_of_speech": "noun",
      "cefr": "A1",
      "first_introduction": "littleroot.player_house.mom.move.002",
      "forms": [
        "покемон",
        "покемоны"
      ]
    },
    {
      "id": "ru.veshchi",
      "lemma": "вещи",
      "english": "things",
      "part_of_speech": "noun",
      "cefr": "A1",
      "first_introduction": "littleroot.player_house.mom.move.002",
      "forms": [
        "вещи"
      ]
    },
    {
      "id": "ru.komnata",
      "lemma": "комната",
      "english": "room",
      "part_of_speech": "noun",
      "cefr": "A1",
      "first_introduction": "littleroot.arrival.mom.006",
      "forms": [
        "комната",
        "комнату",
        "комнате"
      ]
    },
    {
      "id": "ru.naverhu",
      "lemma": "наверху",
      "english": "upstairs; above",
      "part_of_speech": "adverb",
      "cefr": "A1",
      "first_introduction": "littleroot.player_house.mom.move.002",
      "forms": [
        "наверху"
      ]
    },
    {
      "id": "ru.chasy",
      "lemma": "часы",
      "english": "clock; watch (plural noun)",
      "part_of_speech": "noun",
      "cefr": "A1",
      "first_introduction": "littleroot.player_house.mom.move.002",
      "forms": [
        "часы"
      ]
    },
    {
      "id": "ru.pereezd",
      "lemma": "переезд",
      "english": "move to a new home",
      "part_of_speech": "noun",
      "cefr": "A2",
      "first_introduction": "littleroot.player_house.mom.move.002",
      "forms": [
        "переезд",
        "переезду"
      ]
    },
    {
      "id": "ru.posmotri",
      "lemma": "посмотри",
      "english": "look (informal command)",
      "part_of_speech": "verb",
      "cefr": "A1",
      "first_introduction": "littleroot.player_house.mom.room_reminder.003",
      "forms": [
        "посмотри"
      ]
    },
    {
      "id": "ru.vremya",
      "lemma": "время",
      "english": "time",
      "part_of_speech": "noun",
      "cefr": "A1",
      "first_introduction": "littleroot.player_house.clock.004",
      "forms": [
        "время"
      ]
    },
    {
      "id": "ru.stol",
      "lemma": "стол",
      "english": "table; desk",
      "part_of_speech": "noun",
      "cefr": "A1",
      "first_introduction": "littleroot.player_house.mom.room.005",
      "forms": [
        "стол",
        "столе"
      ]
    },
    {
      "id": "ru.poryadok",
      "lemma": "порядок",
      "english": "order; tidiness",
      "part_of_speech": "noun",
      "cefr": "A2",
      "first_introduction": "littleroot.player_house.mom.room.005",
      "forms": [
        "порядок"
      ]
    },
    {
      "id": "ru.vnizu",
      "lemma": "внизу",
      "english": "downstairs; below",
      "part_of_speech": "adverb",
      "cefr": "A1",
      "first_introduction": "littleroot.player_house.mom.room.005",
      "forms": [
        "внизу"
      ]
    },
    {
      "id": "ru.gruzovik",
      "lemma": "грузовик",
      "english": "truck",
      "part_of_speech": "noun",
      "cefr": "A1",
      "first_introduction": "littleroot.arrival.mom.006",
      "forms": [
        "грузовик",
        "грузовике"
      ]
    },
    {
      "id": "ru.skoree",
      "lemma": "скорее",
      "english": "quickly",
      "part_of_speech": "adverb",
      "cefr": "A1",
      "first_introduction": "littleroot.player_house.mom.quick.007",
      "forms": [
        "скорее"
      ]
    },
    {
      "id": "ru.stadion",
      "lemma": "стадион",
      "english": "gym; stadium",
      "part_of_speech": "noun",
      "cefr": "A1",
      "first_introduction": "littleroot.player_house.mom.dad_tv.008",
      "forms": [
        "стадион",
        "стадиона"
      ]
    },
    {
      "id": "ru.reportazh",
      "lemma": "репортаж",
      "english": "report",
      "part_of_speech": "noun",
      "cefr": "A2",
      "first_introduction": "littleroot.player_house.tv_report.009",
      "forms": [
        "репортаж"
      ]
    },
    {
      "id": "ru.zhal",
      "lemma": "жаль",
      "english": "what a pity",
      "part_of_speech": "predicative",
      "cefr": "A1",
      "first_introduction": "littleroot.player_house.mom.missed_dad.010",
      "forms": [
        "жаль"
      ]
    },
    {
      "id": "ru.po_sosedstvu",
      "lemma": "по соседству",
      "english": "next door",
      "part_of_speech": "adverbial phrase",
      "cefr": "A2",
      "first_introduction": "littleroot.player_house.mom.next_door.011",
      "forms": [
        "по соседству"
      ]
    },
    {
      "id": "ru.kontroller",
      "lemma": "контроллер",
      "english": "controller",
      "part_of_speech": "noun",
      "cefr": "A1",
      "first_introduction": "littleroot.player_room.gamecube.012",
      "forms": [
        "контроллер"
      ]
    },
    {
      "id": "ru.bloknot",
      "lemma": "блокнот",
      "english": "notebook",
      "part_of_speech": "noun",
      "cefr": "A1",
      "first_introduction": "littleroot.player_room.notebook.013",
      "forms": [
        "блокнот"
      ]
    },
    {
      "id": "ru.klavisha",
      "lemma": "клавиша",
      "english": "key on a keyboard",
      "part_of_speech": "noun",
      "cefr": "A1",
      "first_introduction": "littleroot.player_house.tv_movie.014",
      "forms": [
        "клавиша"
      ]
    },
    {
      "id": "ru.peredacha",
      "lemma": "передача",
      "english": "TV program",
      "part_of_speech": "noun",
      "cefr": "A1",
      "first_introduction": "littleroot.player_house.tv_program.015",
      "forms": [
        "передача"
      ]
    },
    {
      "id": "ru.kompyuter",
      "lemma": "компьютер",
      "english": "computer",
      "part_of_speech": "noun",
      "cefr": "A1",
      "first_introduction": "littleroot.player_room.pc_boot.016",
      "forms": [
        "компьютер"
      ]
    },
    {
      "id": "ru.priyom",
      "lemma": "приём",
      "english": "move; technique",
      "part_of_speech": "noun",
      "cefr": "A1",
      "first_introduction": "littleroot.rival_room.school_email.017",
      "forms": [
        "приём"
      ]
    },
    {
      "id": "ru.kniga",
      "lemma": "книга",
      "english": "book",
      "part_of_speech": "noun",
      "cefr": "A1",
      "first_introduction": "littleroot.player_room.bookshelf.018",
      "forms": [
        "книга"
      ]
    },
    {
      "id": "ru.polka",
      "lemma": "полка",
      "english": "shelf",
      "part_of_speech": "noun",
      "cefr": "A1",
      "first_introduction": "littleroot.rival_room.picture_books.019",
      "forms": [
        "полка"
      ]
    },
    {
      "id": "ru.sosed",
      "lemma": "сосед",
      "english": "neighbor",
      "part_of_speech": "noun",
      "cefr": "A1",
      "first_introduction": "littleroot.rival_house.mom.welcome.020",
      "forms": [
        "сосед"
      ]
    },
    {
      "id": "ru.muzh",
      "lemma": "муж",
      "english": "husband",
      "part_of_speech": "noun",
      "cefr": "A1",
      "first_introduction": "littleroot.rival_house.mom.husband.022",
      "forms": [
        "муж"
      ]
    },
    {
      "id": "ru.otets",
      "lemma": "отец",
      "english": "father",
      "part_of_speech": "noun",
      "cefr": "A1",
      "first_introduction": "littleroot.rival_house.mom.gone.023",
      "forms": [
        "отец"
      ]
    },
    {
      "id": "ru.vozvrashchatsya",
      "lemma": "возвращаться",
      "english": "to return",
      "part_of_speech": "verb",
      "cefr": "A1",
      "first_introduction": "littleroot.rival_house.mom.visit.024",
      "forms": [
        "возвращаться"
      ]
    },
    {
      "id": "ru.pomogat",
      "lemma": "помогать",
      "english": "to help",
      "part_of_speech": "verb",
      "cefr": "A1",
      "first_introduction": "littleroot.rival_room.may.hello.026",
      "forms": [
        "помогать"
      ]
    },
    {
      "id": "ru.issledovanie",
      "lemma": "исследование",
      "english": "research; investigation",
      "part_of_speech": "noun",
      "cefr": "A1",
      "first_introduction": "littleroot.lab.aide.fieldwork.029",
      "forms": [
        "исследование"
      ]
    },
    {
      "id": "ru.priroda",
      "lemma": "природа",
      "english": "nature",
      "part_of_speech": "noun",
      "cefr": "A1",
      "first_introduction": "littleroot.lab.aide.desk.030",
      "forms": [
        "природа"
      ]
    },
    {
      "id": "ru.izuchat",
      "lemma": "изучать",
      "english": "to study",
      "part_of_speech": "verb",
      "cefr": "A1",
      "first_introduction": "littleroot.lab.aide.family.031",
      "forms": [